{"artifacts":[{"artifact_id":"artifact-0","kind":"recording","local_path":"/evidence/output.mcap","media_type":"application/mcap","recording_summary":{"sha256":"a1d70b5b2039b121adcebdfb7b5b2df5c6ca8561cb965d27db6e8292f9cdb279","size_bytes":443,"uri":"file:///evidence/output.summary.json"},"retention_class":"pull-request-7d","segment_index":0,"sha256":"b55b1327d97412b150ada1a77be869545eb65bb65db52d0d69e6e6a5fb5138de","size_bytes":30,"storage_state":"local","uri":"file:///evidence/output.mcap"}],"finalized":true,"generated_at":"2026-07-11T12:01:00Z","policy_observation":{"compression":"zstd","recording_mode":"bounded","remote_sink_used":false,"retention_class":"pull-request-7d","spool_peak_size_bytes":30,"upload_lag_max_sec":0,"upload_mode":"local_only"},"run_id":"run-10000000-0000-4000-8000-000000000001","schema_version":"evidence-index.v1"}
