{"artifacts":[{"artifact_id":"artifact-0","kind":"observation","local_path":"/evidence/hardware-clock.json","media_type":"application/json","retention_class":"hil-30d","segment_index":0,"sha256":"73b2d93497d7b063c8ee198a73d73e26f265bfd380b41393ca9d2f12f41dd32a","size_bytes":32,"storage_state":"local","uri":"file:///evidence/hardware-clock.json"},{"artifact_id":"artifact-1","kind":"recording","local_path":"/evidence/observation.mcap","media_type":"application/mcap","recording_summary":{"sha256":"cfc060220a12fd9e2af78c5a167937cd0e12f428438c74a0f7cd86b163a1d4ef","size_bytes":443,"uri":"file:///evidence/observation.summary.json"},"retention_class":"hil-30d","segment_index":1,"sha256":"1badcdad7b9ef8b51ac152345aed8a5692202d78e6f0cb27540a0ab7775a82cb","size_bytes":34,"storage_state":"local","uri":"file:///evidence/observation.mcap"}],"finalized":true,"generated_at":"2026-07-12T10:01:00Z","policy_observation":{"compression":"zstd","recording_mode":"bounded","remote_sink_used":true,"retention_class":"hil-30d","spool_peak_size_bytes":66,"upload_lag_max_sec":1,"upload_mode":"closed_segments_during_run"},"run_id":"run-41234567-89ab-4def-8123-456789abcdef","schema_version":"evidence-index.v1"}
